{
  "schema": "kyberia.antenna-pattern/1",
  "model_id": "example/asymmetric-v1",
  "representation": "full_sphere_sample_grid",
  "coordinate_convention": {
    "frame": "right_handed_x_forward_y_left_z_up",
    "angle_unit": "degrees",
    "azimuth_zero_axis": "positive_x",
    "positive_azimuth": "toward_positive_y",
    "positive_elevation": "toward_positive_z"
  },
  "mount_orientation_local_to_world": {"w": 1.0, "x": 0.0, "y": 0.0, "z": 0.0},
  "polarization_basis": "linear_horizontal_vertical",
  "spatial_interpolation": "bilinear_linear_power",
  "frequency_interpolation": "linear_power_reject_outside",
  "sample_order": "elevation_major_azimuth_minor",
  "normalization_tolerance_db": 0.0,
  "source": {
    "source_uri": "urn:rf-atlas:test-pattern/asymmetric-v1",
    "license_spdx": "CC0-1.0",
    "source_checksum_sha256": "abababababababababababababababababababababababababababababababab"
  },
  "azimuth_degrees": [0.0, 90.0, 180.0, 270.0],
  "elevation_degrees": [-90.0, 0.0, 90.0],
  "frequencies": [
    {
      "frequency_hz": 2400000000,
      "nominal_gain": {"value_dbi": 6.0, "uncertainty_db": 0.0},
      "efficiency": {"fraction": 0.8, "uncertainty": 0.1},
      "samples": [
        {"co_polar_gain_dbi": -10.0, "cross_polar_gain_dbi": -20.0},
        {"co_polar_gain_dbi": -10.0, "cross_polar_gain_dbi": -20.0},
        {"co_polar_gain_dbi": -10.0, "cross_polar_gain_dbi": -20.0},
        {"co_polar_gain_dbi": -10.0, "cross_polar_gain_dbi": -20.0},
        {"co_polar_gain_dbi": 6.0, "cross_polar_gain_dbi": 3.0},
        {"co_polar_gain_dbi": 0.0, "cross_polar_gain_dbi": -3.0},
        {"co_polar_gain_dbi": -10.0, "cross_polar_gain_dbi": -13.0},
        {"co_polar_gain_dbi": 0.0, "cross_polar_gain_dbi": -3.0},
        {"co_polar_gain_dbi": -10.0, "cross_polar_gain_dbi": -20.0},
        {"co_polar_gain_dbi": -10.0, "cross_polar_gain_dbi": -20.0},
        {"co_polar_gain_dbi": -10.0, "cross_polar_gain_dbi": -20.0},
        {"co_polar_gain_dbi": -10.0, "cross_polar_gain_dbi": -20.0}
      ]
    },
    {
      "frequency_hz": 5000000000,
      "nominal_gain": {"value_dbi": 0.0, "uncertainty_db": 0.0},
      "efficiency": {"fraction": 1.0, "uncertainty": 0.0},
      "samples": [
        {"co_polar_gain_dbi": -10.0, "cross_polar_gain_dbi": -20.0},
        {"co_polar_gain_dbi": -10.0, "cross_polar_gain_dbi": -20.0},
        {"co_polar_gain_dbi": -10.0, "cross_polar_gain_dbi": -20.0},
        {"co_polar_gain_dbi": -10.0, "cross_polar_gain_dbi": -20.0},
        {"co_polar_gain_dbi": 0.0, "cross_polar_gain_dbi": -3.0},
        {"co_polar_gain_dbi": -6.0, "cross_polar_gain_dbi": -9.0},
        {"co_polar_gain_dbi": -16.0, "cross_polar_gain_dbi": -19.0},
        {"co_polar_gain_dbi": -6.0, "cross_polar_gain_dbi": -9.0},
        {"co_polar_gain_dbi": -10.0, "cross_polar_gain_dbi": -20.0},
        {"co_polar_gain_dbi": -10.0, "cross_polar_gain_dbi": -20.0},
        {"co_polar_gain_dbi": -10.0, "cross_polar_gain_dbi": -20.0},
        {"co_polar_gain_dbi": -10.0, "cross_polar_gain_dbi": -20.0}
      ]
    }
  ]
}
